{
  "generatedAt": "2026-07-27T09:28:49.824Z",
  "owner": {
    "login": "bdelanghe",
    "name": "Robert DeLanghe"
  },
  "stats": {
    "repos": 198,
    "public": 125,
    "private": 73,
    "sources": 188,
    "publicSources": 115,
    "forks": 10,
    "tagged": 58,
    "languages": [
      {
        "name": "TypeScript",
        "count": 64
      },
      {
        "name": "JavaScript",
        "count": 17
      },
      {
        "name": "other",
        "count": 8
      },
      {
        "name": "HTML",
        "count": 6
      },
      {
        "name": "Python",
        "count": 6
      },
      {
        "name": "Nix",
        "count": 5
      },
      {
        "name": "Rust",
        "count": 3
      },
      {
        "name": "Shell",
        "count": 2
      },
      {
        "name": "Go",
        "count": 1
      },
      {
        "name": "Jupyter Notebook",
        "count": 1
      },
      {
        "name": "Rich Text Format",
        "count": 1
      },
      {
        "name": "Scheme",
        "count": 1
      }
    ],
    "topics": [
      {
        "name": "developer-tools",
        "count": 20
      },
      {
        "name": "capability-security",
        "count": 17
      },
      {
        "name": "claude",
        "count": 15
      },
      {
        "name": "security",
        "count": 15
      },
      {
        "name": "library",
        "count": 15
      },
      {
        "name": "claude-code",
        "count": 14
      },
      {
        "name": "agents",
        "count": 13
      },
      {
        "name": "ai",
        "count": 9
      },
      {
        "name": "web",
        "count": 9
      },
      {
        "name": "infrastructure",
        "count": 8
      },
      {
        "name": "ai-agents",
        "count": 7
      },
      {
        "name": "llm",
        "count": 7
      },
      {
        "name": "experiment",
        "count": 7
      },
      {
        "name": "mcp",
        "count": 7
      },
      {
        "name": "learning",
        "count": 6
      },
      {
        "name": "ai-agent",
        "count": 6
      },
      {
        "name": "anthropic",
        "count": 6
      },
      {
        "name": "cli",
        "count": 6
      },
      {
        "name": "game",
        "count": 6
      },
      {
        "name": "algorithms",
        "count": 5
      },
      {
        "name": "agent-infra",
        "count": 4
      },
      {
        "name": "design-tokens",
        "count": 3
      },
      {
        "name": "nix",
        "count": 3
      },
      {
        "name": "data-viz",
        "count": 2
      },
      {
        "name": "github-actions",
        "count": 2
      },
      {
        "name": "profile-readme",
        "count": 1
      },
      {
        "name": "state-machines",
        "count": 1
      },
      {
        "name": "provenance",
        "count": 1
      },
      {
        "name": "transparency",
        "count": 1
      },
      {
        "name": "trust-center",
        "count": 1
      },
      {
        "name": "installer",
        "count": 1
      },
      {
        "name": "provisioning",
        "count": 1
      },
      {
        "name": "verbspec",
        "count": 1
      },
      {
        "name": "zod",
        "count": 1
      },
      {
        "name": "conformance",
        "count": 1
      },
      {
        "name": "object-capability",
        "count": 1
      },
      {
        "name": "seam",
        "count": 1
      },
      {
        "name": "cloudflare",
        "count": 1
      },
      {
        "name": "cloudflare-workers",
        "count": 1
      },
      {
        "name": "credentials",
        "count": 1
      },
      {
        "name": "oidc",
        "count": 1
      }
    ],
    "byOwner": [
      {
        "name": "bounded-systems",
        "count": 84
      },
      {
        "name": "bdelanghe",
        "count": 31
      }
    ]
  },
  "highlights": [
    {
      "name": "prx",
      "fullName": "bounded-systems/prx",
      "url": "https://github.com/bounded-systems/prx",
      "description": "The agent-run work-unit CLI: capability-scoped agents whose privileged effects are verified against a signed owner, driving a work unit through one signed pipeline to a merged PR.",
      "language": "TypeScript",
      "stars": 2,
      "pinned": true,
      "topics": [
        "agent-infra",
        "agents",
        "ai-agent",
        "ai-agents",
        "anthropic",
        "capability-security",
        "claude",
        "claude-code",
        "cli",
        "llm",
        "mcp",
        "security"
      ]
    },
    {
      "name": "guest-room",
      "fullName": "bounded-systems/guest-room",
      "url": "https://github.com/bounded-systems/guest-room",
      "description": "Guest-agnostic room+door capability runtime — the core library claude-box is built on.",
      "language": "TypeScript",
      "stars": 0,
      "pinned": true,
      "topics": [
        "agent-infra",
        "agents",
        "ai-agent",
        "ai-agents",
        "anthropic",
        "capability-security",
        "claude",
        "claude-code",
        "library",
        "llm",
        "mcp",
        "security"
      ]
    },
    {
      "name": "claude-box",
      "fullName": "bounded-systems/claude-box",
      "url": "https://github.com/bounded-systems/claude-box",
      "description": "A capability-secured box for agent sessions — its authority is the door references it holds (keeper/scout/concierge/net), parent-agnostic.",
      "language": "TypeScript",
      "stars": 0,
      "pinned": true,
      "topics": [
        "agent-infra",
        "agents",
        "ai",
        "ai-agent",
        "ai-agents",
        "anthropic",
        "capability-security",
        "claude",
        "claude-code",
        "llm",
        "mcp",
        "security"
      ]
    },
    {
      "name": "door-kit",
      "fullName": "bounded-systems/door-kit",
      "url": "https://github.com/bounded-systems/door-kit",
      "description": "In-box door-client SDK for claude-box's capability doors (keeper/scout/concierge/spawn), over the guest-room protocol",
      "language": "TypeScript",
      "stars": 0,
      "pinned": true,
      "topics": [
        "agents",
        "capability-security",
        "claude",
        "claude-code",
        "library",
        "security"
      ]
    },
    {
      "name": "ocap-provenance",
      "fullName": "bounded-systems/ocap-provenance",
      "url": "https://github.com/bounded-systems/ocap-provenance",
      "description": "Capability-use provenance — a schema + SLSA mapping binding each privileged effect to a signed owner and an auditable chain.",
      "language": "TypeScript",
      "stars": 0,
      "pinned": true,
      "topics": [
        "agents",
        "capability-security",
        "claude",
        "claude-code",
        "library",
        "security"
      ]
    },
    {
      "name": "string-audit",
      "fullName": "bounded-systems/string-audit",
      "url": "https://github.com/bounded-systems/string-audit",
      "description": "Cost-aware, grounded content auditor — typed string symbols, type-scoped audits, CAS-memoized LLM calls.",
      "language": "JavaScript",
      "stars": 0,
      "pinned": true,
      "topics": [
        "ai",
        "capability-security",
        "developer-tools",
        "library",
        "security"
      ]
    }
  ],
  "interests": {
    "count": 226,
    "shown": 30,
    "languages": [
      {
        "name": "TypeScript",
        "count": 51
      },
      {
        "name": "Rust",
        "count": 43
      },
      {
        "name": "Python",
        "count": 41
      },
      {
        "name": "Go",
        "count": 30
      },
      {
        "name": "JavaScript",
        "count": 11
      },
      {
        "name": "HTML",
        "count": 9
      },
      {
        "name": "other",
        "count": 9
      },
      {
        "name": "C",
        "count": 7
      },
      {
        "name": "Jupyter Notebook",
        "count": 4
      },
      {
        "name": "Shell",
        "count": 4
      },
      {
        "name": "Markdown",
        "count": 2
      },
      {
        "name": "Bikeshed",
        "count": 2
      },
      {
        "name": "Swift",
        "count": 2
      },
      {
        "name": "Nix",
        "count": 1
      },
      {
        "name": "CSS",
        "count": 1
      },
      {
        "name": "SCSS",
        "count": 1
      },
      {
        "name": "C++",
        "count": 1
      },
      {
        "name": "PHP",
        "count": 1
      },
      {
        "name": "Makefile",
        "count": 1
      },
      {
        "name": "Nunjucks",
        "count": 1
      },
      {
        "name": "Pony",
        "count": 1
      },
      {
        "name": "Dockerfile",
        "count": 1
      },
      {
        "name": "Awk",
        "count": 1
      },
      {
        "name": "TeX",
        "count": 1
      }
    ],
    "topics": [
      {
        "name": "ai",
        "count": 32
      },
      {
        "name": "cli",
        "count": 32
      },
      {
        "name": "rust",
        "count": 25
      },
      {
        "name": "security",
        "count": 24
      },
      {
        "name": "ai-agents",
        "count": 22
      },
      {
        "name": "developer-tools",
        "count": 21
      },
      {
        "name": "claude-code",
        "count": 17
      },
      {
        "name": "llm",
        "count": 15
      },
      {
        "name": "python",
        "count": 15
      },
      {
        "name": "terminal",
        "count": 15
      },
      {
        "name": "agents",
        "count": 14
      },
      {
        "name": "typescript",
        "count": 13
      },
      {
        "name": "tui",
        "count": 13
      },
      {
        "name": "claude",
        "count": 12
      },
      {
        "name": "hacktoberfest",
        "count": 11
      },
      {
        "name": "openai",